{
  "schema_version": "1.0",
  "provenance_id": "20261020T063842Z-fec85dd9",
  "created": "2026-10-20T06:38:42Z",
  "contributions": [
    {
      "profile": "claude-opus@r1",
      "role": "implementer",
      "model": {
        "family": "anthropic-claude",
        "id": "claude-opus-5-5"
      },
      "model_reported_by": "config",
      "files": [
        ".github/workflows/schema-validate.yml",
        "AGENTS.md",
        "CLAUDE.md"
      ]
    }
  ],
  "human_review": {
    "reviewer": "reimth@etik.com",
    "statement": "pending"
  },
  "session": {
    "ref": "https://claude.ai/code/session_011jVeo4D8sHByAusu9CKSLg"
  }
}
