{
  "schema_version": "1.0",
  "provenance_id": "20261030T002843Z-b49295b9",
  "created": "2026-10-30T00:28:43Z",
  "contributions": [
    {
      "profile": "opencode-kitch@r1",
      "role": "implementer",
      "model": {
        "family": "kitch",
        "id": "KITCH-Coder"
      },
      "model_reported_by": "manual",
      "files": [
        "tools/prov.py",
        "tools/test_prov.py"
      ]
    }
  ],
  "human_review": {
    "reviewer": "thomas.reim@airbus.com",
    "statement": "pending"
  }
}
