{
  "schema_version": "1.0",
  "provenance_id": "20261028T133521Z-d3b2878e",
  "created": "2026-10-28T13:35:21Z",
  "contributions": [
    {
      "profile": "claude-opus@r1",
      "role": "implementer",
      "model": {
        "family": "anthropic-claude",
        "id": "claude-opus-5-5"
      },
      "model_reported_by": "manual",
      "files": [
        "src/racoon/racoon.conf.5.in"
      ]
    }
  ],
  "human_review": {
    "reviewer": "noreply@anthropic.com",
    "statement": "pending"
  }
}
